{
  "crp_version":"0.1",
  "interaction_id":"INT-00184",
  "timestamp":"2026-09-28T14:54:00+05:30",
  "source":{"type":"user","identifier":null},
  "observation":{
    "raw_input":"John cancelled the meeting again.",
    "status":"explicit",
    "facts":[
      {"fact_id":"FACT-001","claim":"John cancelled the meeting.","status":"explicit"},
      {"fact_id":"FACT-002","claim":"The input contains the recurrence marker 'again'.","status":"observed"}
    ]
  },
  "interpretation":{
    "entities":[{"entity_id":"PERSON-JOHN","type":"person","name":"John"}],
    "events":[{"event_id":"EVENT-001","type":"meeting_cancellation","actor":"PERSON-JOHN","target":null}],
    "relationships":[]
  },
  "inferences":[{
    "claim":"John may have a recurring pattern of cancelling meetings.",
    "basis":["FACT-001","FACT-002"],
    "status":"possible"
  }],
  "uncertainty":{"unknowns":["reason_for_cancellation","John's_intention"],"ambiguities":[]},
  "cognitive_updates":[],
  "governance":{"status":"pending","constraints_checked":[],"reason":null},
  "provenance":{"source_interaction":"INT-00184","interpreter":"foundation-model","schema_version":"0.1"}
}
